conference,original_id,UID,title,authors,session,day
inlg,123,inlg123,MiReportor: Medical Imaging Report Generator for Understanding and Interpreting Multimodal Medical Images,Xuwen Wang|Hetong Ma|Zhen Guo|Lin Yang|Jiao Li,,
inlg,124,inlg124,enlg: a Python library for reproducible neural data-to-text experimentation,David M. Howcroft|Dimitra Gkatzia,,
inlg,125,inlg125,VisuaLLM: Easy Web-based Visualization for Neural Language Generation,František Trebuňa|Ondrej Dusek,,
inlg,126,inlg126,Audio Commentary System for Real-Time Racing Game Play,Tatsuya Ishigaki|Goran Topić|Yumi Hamazono|Ichiro Kobayashi|Yusuke Miyao|Hiroya Takamura,,
inlg,9,inlg9,Guided Beam Search to Improve Generalization in Low-Resource Data-to-Text Generation,Nicolas Garneau|Luc Lamontagne,,
inlg,10,inlg10,XF2T: Cross-lingual Fact-to-Text Generation for Low-Resource Languages,Shivprasad Sagare|Tushar Abhishek|Bhavyajeet Singh|Anubhav Sharma|Manish Gupta|Vasudeva Varma,,
inlg,12,inlg12,Preventing Generation of Verbatim Memorization in Language Models Gives a False Sense of Privacy,Daphne Ippolito|Florian Tramer|Milad Nasr|Chiyuan Zhang|Matthew Jagielski|Katherine Lee|Christopher Choquette Choo|Nicholas Carlini,,
inlg,15,inlg15,Fine-Tuning GPT-3 for Synthetic Danish News Generation,Mina Almasi|Anton Schiønning,,
inlg,16,inlg16,GAN-LM: Generative Adversarial Network using Language Models for Downstream Applications,Dae Yon Hwang|Yaroslav Nechaev|Cyprien de Lichy|Renxian Zhang,,
inlg,24,inlg24,Summaries as Captions: Generating Figure Captions for Scientific Documents with Automated Text Summarization,Chieh-Yang Huang|Ting-Yao Hsu|Ryan Rossi|Ani Nenkova|Sungchul Kim|Gromit Yeuk-Yin Chan|Eunyee Koh|C Lee Giles|Ting-Hao Huang,,
inlg,30,inlg30,Models of reference production: How do they withstand the test of time?,Fahime Same|Guanyi Chen|Kees van Deemter,,
inlg,34,inlg34,Generating Faithful Text From a Knowledge Graph with Noisy Reference Text,Tahsina Hashem|Weiqing Wang|Derry Tanti Wijaya|Mohammed Eunus Ali|Yuan-Fang Li,,
inlg,44,inlg44,Entropy-based Sampling for Abstractive Multi-document Summarization in Low-resource Settings,Laura Mascarell|Ribin Chalumattu|Julien Heitmann,,
inlg,47,inlg47,Claim Optimization in Computational Argumentation,Gabriella Skitalinskaya|Maximilian Spliethöver|Henning Wachsmuth,,
inlg,56,inlg56,ChatGPT's Information Seeking Strategy: Insights from the 20-Question Game,Leonardo Bertolazzi|Davide Mazzaccara|Filippo Merlo|Raffaella Bernardi,,
inlg,57,inlg57,This is not correct! Negation-aware Evaluation of Language Generation Systems,Miriam Anschütz|Diego Miguel Lozano|Georg Groh,,
inlg,58,inlg58,Guidance in Radiology Report Summarization: An Empirical Evaluation and Error Analysis,Jan Trienes|Paul Youssef|Jörg Schlötterer|Christin Seifert,,
inlg,71,inlg71,A Zero-Shot Approach for Multi-User Task-Oriented Dialog Generation,Shiv Surya|Yohan Jo|Arijit Biswas|Alexandros Potamianos,,
inlg,83,inlg83,Beyond the Bias: Unveiling the Quality of Implicit Causality Prompt Continuations in Language Models,Judith Sieker|Oliver Bott|Torgrim Solstad|Sina Zarrieß,,
inlg,97,inlg97,Enhancing factualness and controllability of Data-to-Text Generation via data Views and constraints,Craig Thomson|Clement Rebuffel|Ehud Reiter|Laure Soulier|Somayajulu Sripada|patrick Gallinari,,
inlg,99,inlg99,Memories for Virtual AI Characters,Fabian Landwehr|Erika Varis Doggett|Romann M. Weber,,
inlg,107,inlg107,Optimizing Example Selection for In-context Learning: A Case Study in Text Simplification,Subhadra Vadlamannati|Gözde Şahin,,
inlg,115,inlg115,Exploring the Naturalness of Cognitive Status-Informed Referring Form Selection Models,Gabriel Del Castillo|Grace Clark|Zhao Han|Tom Williams,,
inlg,8,inlg8,System-Initiated Transitions from Chit-Chat to Task-Oriented Dialogues with Transition Info Extractor and Transition Sentence Generator,Ye Liu|Stefan Ultes|Wolfgang Minker|Wolfgang Maier,,
inlg,13,inlg13,"HL Dataset: Visually-grounded Description of Scenes, Actions and Rationales",Michele Cafagna|Kees van Deemter|Albert Gatt,,
inlg,25,inlg25,Validating Predictive Models Of Evaluative Language For Controllable Data2Text Generation,Maurice Langner|Ralf Klabunde,,
inlg,27,inlg27,Can LLMs Learn better Storytelling With A Few Examples?,Zhuohan Xie|Trevor Cohn|Jey Han Lau,,
inlg,28,inlg28,Trustworthiness of Children Stories Generated by Large Language Models,Prabin Bhandari|Hannah Brennan,,
inlg,50,inlg50,On Text Style Transfer via Style Masked Language Models,Sharan Narasimhan|Pooja H|Suvodip Dey|Maunendra Sankar Desarkar,,
inlg,121,inlg121,Affective Natural Language Generation of Event Descriptions through Fine-grained Appraisal Conditions,Yarik Menchaca Resendiz|Roman Klinger,,
inlg,80,inlg80,Leveraging Low-resource Parallel Data for Text Style Transfer,Sourabrata Mukherjee|Ondrej Dusek,,
inlg,3,inlg3,Reverse-Engineering Language Model Decoding Strategies Given Blackbox Access to a Generation System,Daphne Ippolito|Nicholas Carlini|Katherine Lee|Milad Nasr|Yun William Yu,,
inlg,14,inlg14,Controlling keywords and their positions in text generation,Yuichi Sasazawa|Terufumi Morishita|Hiroaki Ozaki|Osamu Imaichi|Yasuhiro Sogawa,,
inlg,26,inlg26,Tackling Hallucinations in Neural Chart Summarization,Saad Obaid ul Islam|Iza Škrjanec|Ondrej Dusek|Vera Demberg,,
inlg,41,inlg41,Learning Disentangled Meaning and Style Representations for Positive Text Reframing,Xu Sheng|Fumiyo Fukumoto|Jiyi Li|Go Kentaro|Yoshimi Suzuki,,
inlg,59,inlg59,Generating clickbait spoilers with an ensemble of large language models,Mateusz Woźny|Mateusz Lango,,
inlg,79,inlg79,Reducing named entity hallucination risk to ensure faithful summary generation,Eunice Akani|Benoit Favre|Frederic Bechet|Romain GEMIGNANI,,
inlg,82,inlg82,Building a dual dataset of text- and image-grounded conversations and summarisation in Gàidhlig (Scottish Gaelic),David M. Howcroft|William Lamb|Anna Groundwater|Dimitra Gkatzia,,
inlg,94,inlg94,Generating Multiple Questions from Presentation Transcripts: A Pilot Study on Earnings Conference Calls,Yining Juan|Chung-Chi Chen|Hen-Hsen Huang|Hsin-Hsi Chen,,
inlg,100,inlg100,Mod-D2T: A Multi-layer Dataset for Modular Data-to-Text Generation,Simon Mille|Francois Lareau|Anya Belz|Stamatia Dasiopoulou,,
sigdial,156,sigdial156,ChatGPT vs. Crowdsourcing vs. Experts: Annotating Open-Domain Conversations with Speech Functions,Lidiia Ostyakova|Veronika Smilga|Kseniia Petukhova|Maria Molchanova|Daniel Kornev,sigdialoralsession2,
sigdial,29,sigdial29,Towards Breaking the Self-imposed Filter Bubble in Argumentative Dialogues,Annalena Aicher|Daniel Kornmueller|Yuki Matsuda|Stefan Ultes|Wolfgang Minker|Keiichi Yasumoto,sigdialoralsession5,
sigdial,74,sigdial74,Opinionconv: A Framework for Generating Opinionated Conversations for Product Search,Vahid Sadiri Javadi|Martin Potthast|Lucie Flek,sigdialpostersession1,
sigdial,79,sigdial79,DiactTOD: Learning Generalizable Latent Dialogue Acts for Controllable Task-Oriented Dialogue Systems,Qingyang Wu|James Gung|Raphael Shu|Yi Zhang,sigdialoralsession3,
sigdial,80,sigdial80,Grounded Complex Task Segmentation for Conversational Assistants,Rafael Ferreira|David Semedo|Joao Magalhaes,sigdialoralsession1,
sigdial,86,sigdial86,Sources of Noise in Dialogue and How to Deal with Them,Derek Chen|Zhou Yu,sigdialoralsession1,
sigdial,81,sigdial81,The Open-domain Paradox for Chatbots: Common Ground as the Basis for Human-like Dialogue,Gabriel Skantze|A. Seza Doğruöz,sigdialoralsession5,
sigdial,104,sigdial104,UD_Japanese-CEJC: Dependency Relation Annotation on Corpus of Everyday Japanese Conversation,Mai Omura|Hiroshi Matsuda|Masayuki Asahara|Aya Wakasa,sigdialpostersession2,
sigdial,154,sigdial154,"Unravelling Indirect Answers to Wh-Questions: Corpus Construction, Analysis, and Generation",Zulipiye Yusupujiang|Jonathan Ginzburg,sigdialpostersession2,
sigdial,15,sigdial15,Approximating Online Human Evaluation of Social Chatbots with Prompting,Ekaterina Svikhnushina|Pearl Pu,sigdialoralsession3,
sigdial,97,sigdial97,Dial-M: A Masking-based Framework for Dialogue Evaluation,Suvodip Dey|Maunendra Sankar Desarkar,sigdialpostersession1,
sigdial,12,sigdial12,Dialogue Response Generation Using Completion of Omitted Predicate Arguments Based on Zero Anaphora Resolution,Ayaka Ueyama|Yoshinobu Kano,sigdialoralsession3,
sigdial,129,sigdial129,Syndicom: Improving Conversational Commonsense with Error-Injection and Natural Language Feedback,Christopher Richardson|Larry Heck,sigdialoralsession3,
sigdial,14,sigdial14,Investigating Explicitation of Discourse Connectives in Translation using Automatic Annotations,Frances Yung|Merel Scholman|Ekaterina Lapshinova-Koltunski|Christina Pollkläsener|Vera Demberg,sigdialoralsession1,
sigdial,43,sigdial43,What's Hard in RST Parsing? Predictive Models for Error Analysis,Yang Janet Liu|Amir Zeldes|Tatsuya Aoyama,sigdialoralsession1,
sigdial,91,sigdial91,A Statistical Approach for Quantifying Group Difference in Topic Distributions Using Clinical Discourse Samples,Grace Lawley|Peter A. Heeman|Jill K. Dolata|Eric Fombonne|Steven Bedrick,sigdialoralsession1,
sigdial,90,sigdial90,From Chatter to Matter: Addressing Critical Steps of Emotion Recognition Learning in Task-oriented Dialogue,Shutong Feng|Nurul Lubis|Benjamin Ruppik|Christian Geishauser|Michael Heck|Hsien-chin Lin|Carel van Niekerk|Renato Vukovic|Milica Gasic,sigdialpostersession1,
sigdial,27,sigdial27,Empathetic Response Generation for Distress Support,Anuradha Welivita|Chun-Hung Yeh|Pearl Pu,sigdialoralsession5,
sigdial,73,sigdial73,Reasoning before Responding: Integrating Commonsense-based Causality Explanation for Empathetic Response Generation,Yahui Fu|Koji Inoue|Chenhui Chu|Tatsuya Kawahara,sigdialoralsession5,
sigdial,5,sigdial5,Slot Induction via Pre-trained Language Model Probing and Multi-level Contrastive Learning,Hoang Nguyen|Chenwei Zhang|Ye Liu|Philip Yu,sigdialoralsession4,
sigdial,34,sigdial34,Grounding Description-Driven Dialogue State Trackers with Knowledge-Seeking Turns,Alexandru Coca|Bo-Hsiang Tseng|Jinghong Chen|Weizhe Lin|Weixuan Zhang|Tisha Anders|Bill Byrne,sigdialoralsession4,
sigdial,19,sigdial19,Who says what when? Why timing is mission-critical for conversational speech recognition and dialogue systems,Andreas Liesenfeld|Alianda Lopez|Mark Dingemanse,sigdialoralsession4,
sigdial,25,sigdial25,Are Large Language Models All You Need for Task-Oriented Dialogue?,Vojtěch Hudeček|Ondrej Dusek,sigdialoralsession2,
sigdial,106,sigdial106,Leveraging Large Language Models for Automated Dialogue Analysis,Sarah E. Finch|Ellie S. Paek|Jinho D. Choi,sigdialoralsession2,
sigdial,109,sigdial109,"Multi-party Goal Tracking with LLMs: Comparing Pre-training, Fine-tuning, and Prompt Engineering",Angus Addlesee|Weronika Sieińska|Nancie Gunson|Daniel Hernandez Garcia|Christian Dondrup|Oliver Lemon,sigdialoralsession2,
sigdial,56,sigdial56,Analyzing Differences in Subjective Annotations by Participants and Third-party Annotators in Multimodal Dialogue Corpus,Kazunori Komatani|Ryu Takeda|Shogo Okada,sigdialpostersession1,
sigdial,49,sigdial49,Learning Multimodal Cues of Children's Uncertainty,Qi Cheng|Mert Inan|Rahma Mbarki|Theresa Choi|Yiming Sun|Kimele Persaud|Jenny Wang|Malihe Alikhani,sigdialoralsession4,
sigdial,122,sigdial122,Resolving References in Visually-Grounded Dialogue via Text Generation,Bram Willemsen|Livia Qian|Gabriel Skantze,sigdialoralsession4,
sigdial,130,sigdial130,MERCY: Multiple Response Ranking Concurrently in Realistic Open-Domain Conversational Systems,Sarik Ghazarian|Behnam Hedayatnia|Di Jin|Sijia Liu|Nanyun Peng|Yang Liu|Dilek Hakkani-Tur,sigdialoralsession5,
sigdial,163,sigdial163,"""What do others think?"": Task-Oriented Conversational Modeling with Subjective Knowledge",Chao Zhao|Spandana Gella|Seokhwan Kim|Di Jin|Devamanyu Hazarika|Alexandros Papangelis|Behnam Hedayatnia|Mahdi Namazifar|Yang Liu|Dilek Hakkani-Tur,sigdialoralsession3,
sigdial,54,sigdial54,Enhancing Task Bot Engagement with Synthesized Open-Domain Dialog,Miaoran Li|Baolin Peng|Michel Galley|Jianfeng Gao|Zhu (Drew) Zhang,sigdialpostersession1,
sigdial,67,sigdial67,Frame-oriented Summarization of Argumentative Discussions,Shahbaz Syed|Timon Ziegenbein|Philipp Heinisch|Henning Wachsmuth|Martin Potthast,sigdialpostersession1,
sigdial,153,sigdial153,A New Dataset for Causality Identification in Argumentative Texts,Khalid Al Khatib|Michael Völske|Anh Le|Shahbaz Syed|Martin Potthast|Benno Stein,sigdialpostersession2,
sigdial,125,sigdial125,Controllable Generation of Dialogue Acts for Dialogue Systems via Few-Shot Response Generation and Ranking,Angela Ramirez|Kartik Agarwal|Juraj Juraska|Utkarsh Garg|Marilyn Walker,sigdialpostersession2,
sigdial,117,sigdial117,Reference Resolution and New Entities in Exploratory Data Visualization: From Controlled to Unconstrained Interactions with a Conversational Assistant,Abari Bhattacharya|Abhinav Kumar|Barbara Di Eugenio|Roderick Tabalba|Jillian Aurisano|Veronica Grosso|Andrew Johnson|Jason Leigh|Moira Zellner,sigdialpostersession2,
sigdial,20,sigdial20,Towards Multilingual Automatic Open-Domain Dialogue Evaluation,John Mendonca|Alon Lavie|Isabel Trancoso,sigdialpostersession1,
sigdial,40,sigdial40,Dialog Action-Aware Transformer for Dialog Policy Learning,Huimin Wang|Wai Chung Kwan|Kam-Fai Wong,sigdialpostersession1,
sigdial,75,sigdial75,The Wizard of Curiosities: Enriching Dialogues with Epistemic Fun-facts,Frederico Vicente|Rafael Ferreira|David Semedo|Joao Magalhaes,sigdialpostersession1,
sigdial,46,sigdial46,Transformer-based Multi-Party Conversation Generation using Dialogue Discourse Acts Planning,Alexander Chernyavskiy|Dmitry Ilvovsky,virtualpostersession,
sigdial,148,sigdial148,CONVERSER: Few-shot Conversational Dense Retrieval with Synthetic Data Generation,Chao-Wei Huang|Chen-Yu Hsu|Tsu-Yuan Hsu|Chen-An Li|Yun-Nung Chen,sigdialpostersession2,
sigdial,128,sigdial128,Incorporating annotators' uncertainty to discourse relations representations,S. Magalí López Cortez|Cassandra L. Jacobs,sigdialpostersession2,
sigdial,35,sigdial35,The Road to Quality is Paved with Good Revisions: A Detailed Evaluation Methodology for Revision Policies in Incremental Sequence Labelling,Brielen Madureira|Patrick Kahardipraja|David Schlangen,sigdialpostersession1,
sigdial,4,sigdial4,The effect of conversation type on entrainment: Evidence from laughter,Bogdan Ludusan|Petra Wagner,sigdialpostersession1,
sigdial,30,sigdial30,Investigating the Representation of Open Domain Dialogue Context for Transformer Models,Vishakh Padmakumar|Behnam Hedayatnia|Di Jin|Patrick Lange|Seokhwan Kim|Nanyun Peng|Yang Liu|Dilek Hakkani-Tur,virtualpostersession,
sigdial,123,sigdial123,Speaker Role Identification in Call Center Dialogues: Leveraging Opening Sentences and Large Language Models,Minh-Quoc Nghiem|Nichola Roberts|Dmitry Sityaev,sigdialpostersession2,
sigdial,42,sigdial42,C3: Compositional Counterfactual Constrastive Learning for Video-grounded Dialogues,Hung Le|Nancy Chen|Steven C.H. Hoi,virtualpostersession,
sigdial,50,sigdial50,‘What are you referring to?' Evaluating the ability of multi-modal dialogue models to process clarificational exchanges,Javier Chiyah-Garcia|Alessandro Suglia|Arash Eshghi|Helen Hastie,sigdialpostersession1,
sigdial,3,sigdial3,PGTask: Introducing the Task of Profile Generation from Dialogues,Rui Ribeiro|Joao Paulo Carvalho|Luisa Coheur,sigdialpostersession1,
sigdial,146,sigdial146,Synthesising Personality with Neural Speech Synthesis,Shilin Gao|Matthew P. Aylett|David A. Braude|Catherine Lai,sigdialpostersession2,
sigdial,59,sigdial59,No that's not what I meant: Handling Third Position Repair in Conversational Question Answering,Vevake Balaraman|Arash Eshghi|Ioannis Konstas|Ioannis Papaioannou,virtualpostersession,
sigdial,61,sigdial61,Question Generation to Elicit Users' Food Preferences Considering the Semantic Content,Jie Zeng|Yukiko Nakano|Tatsuya Sakato,sigdialpostersession1,
sigdial,138,sigdial138,Improve Zero-shot Performance on Unseen Dialog Domains with Retrieval-Augmented Task-Oriented Systems,Jianguo Zhang|Stephen Roller|Kun Qian|Zhiwei Liu|Rui Meng|Shelby Heinecke|Huan Wang|silvio savarese|Caiming Xiong,virtualpostersession,
sigdial,121,sigdial121,"Prompting, Retrieval, Training: An exploration of different approaches for task-oriented dialogue generation",Gonçalo Raposo|Luisa Coheur|Bruno Martins,sigdialpostersession2,
sigdial,132,sigdial132,Bootstrapping a Conversational Guide for Colonoscopy Prep,Pulkit Arya|Madeleine Bloomquist|SUBHANKAR CHAKRABORTY|Andrew Perrault|William Schuler|Eric Fosler-Lussier|Michael White,sigdialpostersession2,
sigdial,155,sigdial155,Applying Item Response Theory to Task-oriented Dialogue Systems for Accurately Determining User's Task Success Ability,Ryu Hirai|Ao Guo|Ryuichiro Higashinaka,sigdialpostersession2,
sigdial,147,sigdial147,When to generate hedges in peer-tutoring interactions,Alafate Abulimiti|Chloé Clavel|Justine Cassell,,
sigdial,45,sigdial45,PaperPersiChat: Scientific Paper Discussion Chatbot using Transformers and Discourse Flow Management,Alexander Chernyavskiy|Max Bregeda|Maria Nikiforova,virtualpostersession,
sigdial,48,sigdial48,Roll Up Your Sleeves: Working with a Collaborative and Engaging Task-Oriented Dialogue System,Lingbo Mo|Shijie Chen|Ziru Chen|Xiang Deng|Ashley Lewis|Sunit Singh|Samuel Stevens|Chang-You Tai|Zhen Wang|Xiang Yue|Tianshu Zhang|Yu Su|Huan Sun,sigdialpostersession1,
sigdial,70,sigdial70,An Open-Domain Avatar Chatbot by Exploiting a Large Language Model,Takato Yamazaki|Tomoya Mizumoto|Katsumasa Yoshikawa|Masaya Ohagi|Toshiki Kawamoto|Toshinori Sato,sigdialpostersession2,
sigdial,103,sigdial103,"FurChat: An Embodied Conversational Agent using LLMs, Combining Open and Closed-Domain Dialogue with Facial Expressions",Neeraj Cherakara|Finny Varghese|Sheena Shabana|Nivan Nelson|Abhiram Karukayil|Rohith Kulothungan|Mohammed Afil Farhan|Birthe Nesset|Meriam Moujahid|Tanvi Dinkar|Verena Rieser|Oliver Lemon,virtualpostersession,
sigdial,D&D1,sigdialD&D1,Studying Alignment in a Collaborative Learning Activity via Automatic Methods: The Link Between What We Say and Do,Utku Norman|Tanvi Dinkar|Barbara Bruno|Chloé Clavel,sigdialpostersession2,
sigdial,D&D2,sigdialD&D2,The effect of domain knowledge on discourse relation inferences: Relation marking and interpretation strategies,Marian Marchal|Saarland University|Merel C.J. Scholman|Vera Demberg,sigdialpostersession2,
sigdial,D&D3,sigdialD&D3,"Bullshit, Pragmatic Deception, and Natural Language Processing",Oliver Deck,sigdialpostersession2,
